{
  "$schema": "https://json-schema.org/draft/2020-12/schema",
  "type": "object",
  "additionalProperties": false,
  "required": ["task_id", "run_id", "phase", "user_decision_status", "freeze_decision_status", "freeze_plan_status", "independent_validation_status", "anomaly_scan_status", "scientific_review_status", "repository_final_gate_status", "phase_a_automatic_recommendation_authoritative", "phase_a_user_override", "pareto_recommendation_recomputed", "pareto_recommendation_used_for_final_decision", "decision_validation_mode", "hard_gate_evidence_status", "selected_version_count", "strict_core_only_count", "rejected_pair_count", "decision_hash", "freeze_decision_hash", "freeze_plan_hash", "phase_a_artifacts_preserved", "source_artifact_bindings", "formal_task_completed", "R2-T05_allowed_to_start", "R3_allowed_to_start"],
  "properties": {
    "task_id": {"const": "R2-T04"}, "run_id": {"const": "R2-T04-20260713T120000Z"}, "phase": {"const": "A+B_author_stage"}, "user_decision_status": {"const": "recorded"}, "freeze_decision_status": {"const": "passed"}, "freeze_plan_status": {"const": "passed"}, "independent_validation_status": {"enum": ["pending", "passed"]}, "anomaly_scan_status": {"const": "passed"}, "scientific_review_status": {"const": "pending_independent_scientific_review"}, "repository_final_gate_status": {"const": "pending_independent_scientific_review_and_exact_head_validation"}, "phase_a_automatic_recommendation_authoritative": {"const": false}, "phase_a_user_override": {"const": true}, "pareto_recommendation_recomputed": {"const": false}, "pareto_recommendation_used_for_final_decision": {"const": false}, "decision_validation_mode": {"const": "explicit_user_override_over_hard_gate_eligible_candidates"}, "hard_gate_evidence_status": {"const": "passed"}, "selected_version_count": {"const": 2}, "strict_core_only_count": {"const": 2}, "rejected_pair_count": {"const": 2}, "decision_hash": {"type": "string", "pattern": "^[0-9a-f]{64}$"}, "freeze_decision_hash": {"type": "string", "pattern": "^[0-9a-f]{64}$"}, "freeze_plan_hash": {"type": "string", "pattern": "^[0-9a-f]{64}$"}, "phase_a_artifacts_preserved": {"const": true}, "source_artifact_bindings": {"type": "array", "minItems": 1, "items": {"type": "object"}}, "source_artifacts": {"type": "array", "minItems": 1, "items": {"type": "object"}}, "independent_validation_path": {"const": "r2_t04_phase_b_independent_validation.json"}, "formal_task_completed": {"const": false}, "R2-T05_allowed_to_start": {"const": false}, "R3_allowed_to_start": {"const": false}
  }
}
