{"R2-T05_allowed_to_start":false,"R3_allowed_to_start":false,"anomaly_scan_status":"passed","decision_hash":"f1344346662225f1f0837bc160be1bf6f88f12174cbacc8f27f8a126ad9bf3bf","decision_validation_mode":"explicit_user_override_over_hard_gate_eligible_candidates","formal_task_completed":false,"freeze_decision_hash":"ceb99c3480aa49a13a545dd06d43a85c2faf378256c49623b17d1b0255e0048d","freeze_decision_status":"passed","freeze_plan_hash":"1ea368d67b9445a6916ee31ff33e6f0a5f94ed43b0fd5a2b716f8d60c39a80dc","freeze_plan_status":"passed","hard_gate_evidence_status":"passed","independent_validation_path":"r2_t04_phase_b_independent_validation.json","independent_validation_status":"passed","pareto_recommendation_recomputed":false,"pareto_recommendation_used_for_final_decision":false,"phase":"A+B_author_stage","phase_a_artifacts_preserved":true,"phase_a_automatic_recommendation_authoritative":false,"phase_a_user_override":true,"rejected_pair_count":2,"repository_final_gate_status":"pending_independent_scientific_review_and_exact_head_validation","run_id":"R2-T04-20260713T120000Z","scientific_review_status":"pending_independent_scientific_review","selected_version_count":2,"source_artifact_bindings":[{"path":"data/generated/r2/r2_t04/R2-T04-20260713T120000Z/r2_t04_input_binding.json","role":"phase_a_preserved_artifact","sha256":"678546b657147eaa09ae9cb2a3f338cfea5b119ec3e3b66b7fee40946f7ea334"},{"path":"data/generated/r2/r2_t04/R2-T04-20260713T120000Z/r2_t04_automatic_recommendation.json","role":"phase_a_preserved_artifact","sha256":"076a1395f86e6e317197ffbe3ebe651f1b822797d3a94d5742c20d31707534dd"},{"path":"data/generated/r2/r2_t04/R2-T04-20260713T120000Z/r2_t04_hard_gate_report.csv","role":"phase_a_preserved_artifact","sha256":"c5be6b074294e60e00b1fb7dc5f09ef67520e40445028573f273df1975fa26bb"},{"path":"data/generated/r2/r2_t04/R2-T04-20260713T120000Z/r2_t04_cell_gate_summary.csv","role":"phase_a_preserved_artifact","sha256":"ba668dc0686d1adbba4a93e15f45d59616be10971f20ac8e34012acc7e682c68"},{"path":"data/generated/r2/r2_t03/R2-T03-PROMOTED-20260713T050903Z/r2_t03_cell_execution_registry.csv","role":"t03_compact","sha256":"aefc70132acf2dd3d033f17d415a6a768b2a9fa937a110490e7943a0dbaa7ada"},{"path":"data/generated/r2/r2_t03/R2-T03-PROMOTED-20260713T050903Z/r2_t03_metric_results.csv","role":"t03_compact","sha256":"f48cab543258443ea33c5d4ffaaee37ae118aa0544f39649b2735adb31ac2b53"},{"path":"data/generated/r2/r2_t03/R2-T03-PROMOTED-20260713T050903Z/r2_t03_dg_event_zone_profile.csv","role":"t03_compact","sha256":"8562f53fc798e4463a79cdf7a87ef9d66cba6281e302ae85b625b3ad7fd73dda"},{"path":"data/generated/r2/r2_t03/R2-T03-PROMOTED-20260713T050903Z/r2_t03_atomic_baseline_profile.csv","role":"t03_compact","sha256":"78d4a68a90a85b015d57f9e1cd24ddcb436fdce91ed4c56cc683fab6cad106f0"},{"path":"data/generated/r2/r2_t03/R2-T03-PROMOTED-20260713T050903Z/r2_t03_atomic_interval_diagnostic_profile.csv","role":"t03_compact","sha256":"7c389dde8516cadb80d2f791868e5781f3bfbd359d419c842c494f8197e4e905"},{"path":"data/generated/r2/r2_t03/R2-T03-PROMOTED-20260713T050903Z/r2_t03_component_diagnostic_profile.csv","role":"t03_compact","sha256":"6d7a30a0542fbd0435cb9d6283e6aee5a4e658d70c0a6b5b07bdef5bec4dae07"},{"path":"data/generated/r2/r2_t03/R2-T03-PROMOTED-20260713T050903Z/r2_t03_event_zone_diagnostic_profile.csv","role":"t03_compact","sha256":"1ac1a57446e3c971f2f5554c1f2456d04d64d7803730fd211d5903a023ca443c"},{"path":"data/generated/r2/r2_t03/R2-T03-PROMOTED-20260713T050903Z/r2_t03_parameter_invariant_profile.csv","role":"t03_diagnostics","sha256":"18847b6a0d19affebd6953309f189d30896e408ba7bb8c9e07b8eb909c247dc4"},{"path":"data/generated/r2/r2_t03/R2-T03-PROMOTED-20260713T050903Z/r2_t03_window_diagnostic_profile.csv","role":"t03_diagnostics","sha256":"f03fb009ca32628502014ecff9afdffeefd101f1890f5e73014b7d7ca18f9beb"},{"path":"data/generated/r2/r2_t03/R2-T03-PROMOTED-20260713T050903Z/r2_t03_strict_core_diagnostic_profile.csv","role":"t03_diagnostics","sha256":"48baf3c99b1291ad0e2db0b4dff280a67d628abc1c4761cd8a6d642d5cca4537"},{"path":"data/generated/r2/r2_t03/R2-T03-PROMOTED-20260713T050903Z/r2_t03_strict_core_shell_profile.csv","role":"t03_diagnostics","sha256":"06e3d16a9f6e2b315b2ba3461282e9ae7024d7632f5a3e47d70bf7397ff698bb"},{"path":"data/generated/r2/r2_t03/R2-T03-PROMOTED-20260713T050903Z/r2_t03_anomaly_scan.json","role":"t03_validation","sha256":"8e53045b8ec712890b78feb4674e34be6dd53d57b4dc2f178d0053a0fe07547e"},{"path":"data/generated/r2/r2_t03/R2-T03-PROMOTED-20260713T050903Z/r2_t03_runtime_gate_results.csv","role":"t03_validation","sha256":"3ae1800b45fb7dede20c379e508cf052d438748e82b86bd49611304cb3dc3de0"},{"path":"data/generated/r2/r2_t03/R2-T03-PROMOTED-20260713T050903Z/r2_t03_independent_validation.json","role":"t03_validation","sha256":"a0feff3ef844f3ecf3366cdf95657433c53f462978bf7f78cb5cf4b20c9d483e"},{"path":"data/generated/r2/r2_t03/R2-T03-PROMOTED-20260713T050903Z/r2_t03_result_package.json","role":"t03_validation","sha256":"46e0a8e06db3d17b395cdfeb900e364853b93645c602b09f04bd0e9dfb98afd6"},{"path":"data/generated/r2/r2_t03/R2-T03-PROMOTED-20260713T050903Z/r2_t03_repository_final_gate_handoff_validation.json","role":"t03_handoff","sha256":"90c28efd9fa232f2fcdd05edb258aa7d91f829f1a16dfc5671dfa7057252aa48"},{"path":"data/generated/r2/r2_t03/R2-T03-PROMOTED-20260713T050903Z/r2_t03_author_stage_scientific_review.json","role":"t03_author_package","sha256":"5311a6d379483eaee19f73885c8b8bcd552196ac57137c0a890b5753e5f530cb"},{"path":"data/generated/r2/r2_t02/R2-T02-20260712T1700Z/r2_t02_hard_gate_registry.csv","role":"t02_contract","sha256":"533978218585c510693d4236261b23d7a42834786a699412200e9d5f0d2012f5"},{"path":"data/generated/r2/r2_t02/R2-T02-20260712T1700Z/r2_t02_metric_dictionary.csv","role":"t02_contract","sha256":"aa56c49dce9484e7031fde9f345cc918bba70cb8b4cdc222e37ea63582cca00c"},{"path":"data/generated/r2/r2_t02/R2-T02-20260712T1700Z/r2_t02_t03_cell_registry.csv","role":"t02_contract","sha256":"7d8f82c189d0c96ba3091ca142d8612e31aeef36ecf20ff9c832009bd41e6ead"},{"path":"data/generated/r2/r2_t02/R2-T02-20260712T1700Z/r2_t02_r3_risk_set_contract.json","role":"t02_contract","sha256":"cb19687a112ba5ceba23c09fdd6923814d6159a088bff1dc78a322c8e5d1250f"},{"path":"data/generated/r2/r2_t02/R2-T02-20260712T1700Z/r2_t02_transition_registry.csv","role":"t02_contract","sha256":"e2656afa07244b5fb2219327dda48dc9a6968e61a87c40662fb882208ca5440e"},{"path":"configs/r2/r2_t02_confirmed_event_zone_state_machine_contract.v8.json","role":"t02_contract","sha256":"2dfcb71d6dd0638052081d3301d38a0b38e576fdd5097d927a8b4fa77737cdcd"},{"path":"data/generated/r2/r2_t02/R2-T02-20260712T1700Z/r2_t02_result_package.json","role":"t02_validation","sha256":"8e0dfc953d146d74c284274254f73bd4d01ba8b88c9c9c643ae398d0391f40ba"},{"path":"data/generated/r2/r2_t02/R2-T02-20260712T1700Z/r2_t02_repository_final_gate_handoff_validation.json","role":"t02_handoff","sha256":"7b296310ce53c18870b484758631a9583d10ed50a99272af34069cb9aade1088"},{"path":"data/generated/r2/r2_t01/R2-T01-20260712T0020Z/r2_t01_primary_shortlist.csv","role":"t01_input","sha256":"cfe9a18cdfef22fa2a5aa7f0658be2784819b95b775de814f08f97d1e95b6144"},{"path":"data/generated/r2/r2_t01/R2-T01-20260712T0020Z/r2_t01_result_package.json","role":"t01_validation","sha256":"1277f2ff92cdc5f9e9fdb1cbdf44cdcc52ecb4b0127c875b8820a68143c64173"},{"path":"data/generated/r1/r1_t14_01/R1-T14-01-20260710T2113Z/r1_t14_01_result_package.json","role":"r1_input","sha256":"300bbc213a1b42b317f1a8ea7452b846ee5406882eae7aff79e9c4ce12138a35"},{"path":"data/generated/r1/r1_t14_02/R1-T14-02-20260711T1100Z/r1_t14_02_result_package.json","role":"r1_input","sha256":"cb5c6c454f7023059ea237c32d574aca13e5b82343ba6ee36e6839711a13eb25"},{"path":"data/generated/r0/r0_t15/R0-T15-20260710T2136Z/r0_t15_result_package.json","role":"r0_input","sha256":"aaea43c420289d95a384b49ce045f69045007ba6a5ac669079d6d3f055d72ac2"}],"source_artifacts":[{"bom":false,"committed_byte_sha256":"aefc70132acf2dd3d033f17d415a6a768b2a9fa937a110490e7943a0dbaa7ada","encoding":"utf-8","git_blob_sha":"9a970213af199cc8f916515080ebd5a1bb06c566","line_ending":"lf","normalized_text_sha256":"aefc70132acf2dd3d033f17d415a6a768b2a9fa937a110490e7943a0dbaa7ada","path":"data/generated/r2/r2_t03/R2-T03-PROMOTED-20260713T050903Z/r2_t03_cell_execution_registry.csv","role":"t03_compact","source_commit":"3d31a8cd8a314ad15d3bccd5d09a003076e6d131","terminal_lf_count":1},{"bom":false,"committed_byte_sha256":"f48cab543258443ea33c5d4ffaaee37ae118aa0544f39649b2735adb31ac2b53","encoding":"utf-8","git_blob_sha":"b64dae71854ebc997f0f0818fc46b265efa5e562","line_ending":"lf","normalized_text_sha256":"f48cab543258443ea33c5d4ffaaee37ae118aa0544f39649b2735adb31ac2b53","path":"data/generated/r2/r2_t03/R2-T03-PROMOTED-20260713T050903Z/r2_t03_metric_results.csv","role":"t03_compact","source_commit":"3d31a8cd8a314ad15d3bccd5d09a003076e6d131","terminal_lf_count":1},{"bom":false,"committed_byte_sha256":"8562f53fc798e4463a79cdf7a87ef9d66cba6281e302ae85b625b3ad7fd73dda","encoding":"utf-8","git_blob_sha":"e8f7fe5ee40c8f67e6853859e2bd61b718547eea","line_ending":"lf","normalized_text_sha256":"8562f53fc798e4463a79cdf7a87ef9d66cba6281e302ae85b625b3ad7fd73dda","path":"data/generated/r2/r2_t03/R2-T03-PROMOTED-20260713T050903Z/r2_t03_dg_event_zone_profile.csv","role":"t03_compact","source_commit":"3d31a8cd8a314ad15d3bccd5d09a003076e6d131","terminal_lf_count":1},{"bom":false,"committed_byte_sha256":"78d4a68a90a85b015d57f9e1cd24ddcb436fdce91ed4c56cc683fab6cad106f0","encoding":"utf-8","git_blob_sha":"2b46d29b3a983f9f54a1c4b149bc55dc1ca2f72c","line_ending":"lf","normalized_text_sha256":"78d4a68a90a85b015d57f9e1cd24ddcb436fdce91ed4c56cc683fab6cad106f0","path":"data/generated/r2/r2_t03/R2-T03-PROMOTED-20260713T050903Z/r2_t03_atomic_baseline_profile.csv","role":"t03_compact","source_commit":"3d31a8cd8a314ad15d3bccd5d09a003076e6d131","terminal_lf_count":1},{"bom":false,"committed_byte_sha256":"7c389dde8516cadb80d2f791868e5781f3bfbd359d4